{
  "schema": "lightluna.synthetic-security-events/v1alpha1",
  "origin": "P0_SYNTHETIC_TEST_ONLY",
  "authority": "NO_KERNEL_OR_NOTIFICATION_AUTHORITY",
  "events": [
    {
      "eventId": "evt_aaaabbbbcccc",
      "kind": "BAN_PROPOSED",
      "severity": "WARN",
      "reason": "AUTH_FAILURE_BURST",
      "occurredUtc": "2026-10-14T10:00:00Z",
      "count": 3,
      "enforcementState": "NOT_ENFORCED_SYNTHETIC",
      "ownerApproved": false,
      "notificationSent": false
    },
    {
      "eventId": "evt_ddddeeeeffff",
      "kind": "GUARDIAN_UNKNOWN",
      "severity": "HIGH",
      "reason": "HEALTH_UNAVAILABLE",
      "occurredUtc": "2026-10-14T11:00:00Z",
      "count": 1,
      "enforcementState": "NOT_ENFORCED_SYNTHETIC",
      "ownerApproved": false,
      "notificationSent": false
    }
  ]
}
